Date,League,Match,Analysis,Odds,Market
20 Apr 2026 | 21:00,Pl,Crystal Palace vs West Ham,Both teams conceding goals consistantly whilst scoring regularly.,1.72,BTTS Yes
21 Apr 2026 | 21:00,PL,Brighton vs Chelsea,Brighton draw no bet because they’re strong at home while Chelsea’s inconsistent form makes them unreliable away from home.,1.89,Brighton Draw no Bet
28 Apr 2026 | 21:00,CL,PSG vs Bayern Munich,Bayern average well over 2 goals per game and consistantly create hight quality chances even against top opposition.,1.99,Bayern Munich Over 1.5
22 Apr 2026 | 21:00,PL,Bournemouth vs Leeds,Draw because both Bournemouth and Leeds have similar form and defensive records, making a closely contested game likely.,3.70,Draw
24 Apr 2026 | 21:00,PL,Sunderland vs Forest,Sunderland to win because they’re strong at home and create more chances, while Forest have struggled for consistency away.,2.90,Sunderland
25 Apr 2026 | 13:30,PL,Fulham vs Aston Villa,Aston Villa to win because they have stronger overall form and a higher goals-per-game average, while Fulham concede regularly against top sides.,2.74,Aston Villa
25 Apr 2026 | 16:00,PL,West Ham vs Everton,Everton to win & under 2.5 goals because they rely on a compact defence and low-scoring games, while West Ham struggle for consistent attacking output.,6.25,Everton & Under 2.5
